{
  "resourceType": "experimentalData",
  "assay": "ChIPSeq",
  "assayTarget": "H3K9ac",
  "species": "Human",
  "organ": "brain",
  "tissue": "dorsolateral prefrontal cortex",
  "fileFormat": "bam",
  "dataType": "chromatinActivity",
  "dataSubtype": "raw",
  "specimenID": "20455807.bam",
  "individualID": "",
  "specimenIdSource": "",
  "individualIdSource": "",
  "grant": "U01AG046152",
  "study": "ROSMAP",
  "consortium": "AMP-AD",
  "isModelSystem": false,
  "cellType": ""
}
